{"schemaVersion":"0.1","id":"react-aria.select","component":"select","sourceManifestDigest":"sha256:f0735cfd23b13c35a497ad8b35c5f91a466e3021bfcb14762c3e43c028ba8ddf","criteria":[{"id":"SEL-SEM-001","category":"semantics","part":"trigger","requirement":"Fixture Select retains label association.","evidenceIds":["react-aria.select.fixture"],"verification":["schema"]}]}
